Date,Ticker,Headline,Source,Summary,URL,FetchedAtUTC
2026-06-22,MARKET,Iran leave note of thanks in LA locker room after draw with Belgium - Reuters,Reuters,Iran leave note of thanks in LA locker room after draw with Belgium  Reuters,https://news.google.com/rss/articles/CBMisAFBVV95cUxNMmdpVk8ySmlSOWJRQjJ3YXI5VGFKcm5DUkZab05LcjBXS2t4bG9yaFdORHJxcXRRc0Q5cGFPbG1tTlVfY3FSX1JwRXRMNEZydWxsVlZCMEN6MXRQTUhlZ00ydnBVMXZtZFRzTWp2WjBfM1ZBYlVHTFpQNVFGRVFvS1plRXY1ZXZBNHQtdjF5SEZ4NTRLRXVxQVFtYWJOdzVwRU5wS2p3ZkdmZWlOaUotZg?oc=5,2026-06-22T06:51:02.747830+00:00
2026-06-22,MARKET,Indian shares rise on Mideast peace hopes; Reliance gets Jio IPO boost - Reuters,Reuters,Indian shares rise on Mideast peace hopes; Reliance gets Jio IPO boost  Reuters,https://news.google.com/rss/articles/CBMipgFBVV95cUxPQnl3WUZuRzA2cHZxX3Bsal8yQlJxUEtFM2NDUk9NcXVXNWZfdVVTazhJTkEzd0k1S3hCc0x2U0dDbnBsQlNPaE9hRFZwV3RzVkJId3UxVmJYbjBPci1hU1JJMTF6M1Njd3dJOEdTVndxcXRINFFLMzVaaHhNMUcweFl5bEZkNExuUXl6OGZLRzA2ZXhxdTNQeFFKaTdEWDI4U0FDOHRB?oc=5,2026-06-22T06:51:02.748093+00:00
2026-06-22,MARKET,Gold rebounds from one-week low as Iran cites progress in peace talks - Reuters,Reuters,Gold rebounds from one-week low as Iran cites progress in peace talks  Reuters,https://news.google.com/rss/articles/CBMiqgFBVV95cUxNWG14bzR3eVBkdmFpZ0VoT0tBUzRBbG0wZVUzWW9wN0hqbDV5SDlYUl9WRWxSZE9sZGsxc2ZCVEhHVDdhQUp0LW5MME0zOTRQM2NCb0h0eGlzZzFNODFVc1NBSFdVYkZCNzg3UnZiYUhpOWRCb0tfUFZaNVlrRDFRX0c2c1M1b3B2U3BROWwwQnlXT2N4LTZJOTRpbUVxdFhycXhQNkp5MzYyQQ?oc=5,2026-06-22T06:51:02.748243+00:00
2026-06-22,MARKET,"Dollar steady as first round of US-Iran talks ends, pound dips on Starmer uncertainty - Reuters",Reuters,"Dollar steady as first round of US-Iran talks ends, pound dips on Starmer uncertainty  Reuters",https://news.google.com/rss/articles/CBMiswFBVV95cUxPVjRxZXNFeklzd3pqbW9WcEQ2Z3AydlJET29VdmV3TUpqaWN2ZjRCaXp5WmpSN0RCcjlPQXl1SkktazBHOGRoSzVOMHI4ZmtlcmFQU3p2akRncGZ6cDl0MllKOFJIZ3VGMzA0anp2YmFNX0RqZ3FuTVN5cmtkQ3FTdW16VDl5eUFZTUVzZFpDRmltX1hoWFhvbzNYbHdYeUZyUFU2S1ZvSEpMYS01OS13NXlhcw?oc=5,2026-06-22T06:51:02.748364+00:00
2026-06-22,MARKET,Stocks rally in Asia as Iran cites progress in talks - Reuters,Reuters,Stocks rally in Asia as Iran cites progress in talks  Reuters,https://news.google.com/rss/articles/CBMihgFBVV95cUxOVUJKVXNjdDQ1Qk4wVGUxU0VYY2FROHplR3N5UW0zT0JjZUgyQnN5MDltTHRxVWtwQktOdUdEcXh1YUY3OTNOUnNWMmNoMXNnRmZTNlI4NzFMeHRoR2Zmd1dwTlJSUldqUkVQcXJfVThwYnhSR0tPMnBUbm5jTW8tQTU3cmtmdw?oc=5,2026-06-22T06:51:02.748480+00:00
2026-06-22,MARKET,"US and Iran conclude high-level talks in Switzerland, mediators say - Reuters",Reuters,"US and Iran conclude high-level talks in Switzerland, mediators say  Reuters",https://news.google.com/rss/articles/CBMiuAFBVV95cUxNZWY0di1pSncycGtYTEtHQm9lQXhCWUxRSnlhMHlKdnJIdzdxYWlCcjdPVF9TeWJ6YXZQYU1oVjh0d1hRajdRaklhYU9CMHROR3VIbnNnSTFSaHJHYk1iNUJmLWhpVWU3VDN0cEE0UVZXTmFFQjYzUFZ1eUNNUFh0MmtDWmxWaUhFTjN0aWxMNGlCQ3Uyb0hBSk1Bd1h5cm9lN0RtOEdZSHdRdUlILVJueXJIQTBoMHMy?oc=5,2026-06-22T06:51:02.748584+00:00
2026-06-21,MARKET,Shipping slows after Iran says it has again shut the Strait of Hormuz - Reuters,Reuters,Shipping slows after Iran says it has again shut the Strait of Hormuz  Reuters,https://news.google.com/rss/articles/CBMitwFBVV95cUxPSW92ZEc3ZzRkZ3lVbEtGaWYyRUxWOG5XUDZTbWx6ay1nVUFETUFLSUs0LTVwNWJUeXNoaHlGU0R0aXlaai1MeEhucnZBVnRINWxXZGpqbDYtN2VjVnNlZXpRdVplRE1pUlY4RTRqTXV4TWRoNWlrS1BZbk1OV0o5OGVGUlk5U2dvWThiTktlWUp1aF9ERVJ3M3R2c0pVWjNweXdWdU5Ia2IwaWp0RTVxSm5lQmcxdGs?oc=5,2026-06-22T06:51:02.748680+00:00
2026-06-21,MARKET,Beiranvand heroics help Iran hold 10-man Belgium to goalless draw - Reuters,Reuters,Beiranvand heroics help Iran hold 10-man Belgium to goalless draw  Reuters,https://news.google.com/rss/articles/CBMimAFBVV95cUxQR01ibEVGdmNYc0l0VFlWQzI0SUVoSXZzb1RsSVlXckhQNnZyV2ZfZXZpbTk1U21GN1FqeDJNUTRkQ1prWFR6ZDA3TEpJNkNrVUJwc05MNTU2eUQ0NHhZTXduT3NLd2lZZVM5QkdUeEdycExqZUt3eEdycGlaeFZ5QUlvNHFjckR3VV9qN3ZobkxEQjdEbmpHdA?oc=5,2026-06-22T06:51:02.748783+00:00
2026-06-21,MARKET,Brent falls after US-Iran talks conclude in Switzerland - Reuters,Reuters,Brent falls after US-Iran talks conclude in Switzerland  Reuters,https://news.google.com/rss/articles/CBMivAFBVV95cUxPWDktZEMyRnJ6ZUlaRUlUT3U2c0ZhTFluQm5kWHI3YkdBRTc0QVM0XzVYUHJmdGhzZUJMZ2pHTVdhclpUVVdBdUZ0dktUVUZ0SHpnS0UxY3BTMnJDUW10dnlKZEtiYjZvSkRoR3h1NTUyU2xUZ3NXTUlxTFNKemlyd3BLbUhEOGRmYUpfSnFvQ0R0c2tIMUowUDFRdXJyc2E3bXU1QTEwa3pKUldDRDlVXzR6QkxmNmpoQVk1Sw?oc=5,2026-06-22T06:51:02.748879+00:00
2026-06-21,MARKET,"Iran talks, JD Vance, Reflecting Pool and Keir Starmer - Reuters",Reuters,"Iran talks, JD Vance, Reflecting Pool and Keir Starmer  Reuters",https://news.google.com/rss/articles/CBMimAFBVV95cUxQMDhtUzRGRk9oZEZLX3FnWVl5WF9uVmRsbGNqTUpmWVVFLVA1VmhCdEZ0Q3pqbVZNR1M0dmwtVTFpeFRBQ19jOVdjeHp4R1dQQmZJUTVpand1b2pnd3NqLVBLSDhHZElnalczbWRqTE5ENUdYa0oyWkJJZVZzb1pwTzRrUzNjN2lVR0E4RTRJem84UWo4MmJMWg?oc=5,2026-06-22T06:51:02.748972+00:00
2026-06-21,MARKET,The AI trade has left the hyperscalers in the dust. What will it take for that to change?,CNBC,"In his Sunday column for Investing Club subscribers, Jim Cramer examines the market's love affair with memory and semi-cap equipment stocks.",https://www.cnbc.com/2026/06/21/the-ai-trade-has-left-the-hyperscalers-in-the-dust-what-will-it-take-for-that-to-change-.html,2026-06-22T06:51:02.749068+00:00
2026-06-21,MARKET,Raising the minimum wage has been a big political winner. Now it's running into resistance,CNBC,"Raising the minimum wage has been a progressive policy winner at the ballot box, but recent losses suggest an economic mood slowing its political momentum.",https://www.cnbc.com/2026/06/21/raise-minimum-wage-inflation-politics.html,2026-06-22T06:51:02.749180+00:00
2026-06-21,MARKET,Trump says US will resume attacks if Iran does not restrain Hezbollah allies - Reuters,Reuters,Trump says US will resume attacks if Iran does not restrain Hezbollah allies  Reuters,https://news.google.com/rss/articles/CBMiygFBVV95cUxPRnRDWmZ2cjd6SldKNEFTZ3pKNFBSeE52eUk1cUpuZ3lWdUJDTU5sbXkybHVTLWN1SWVYMDBhMUROTU01VHhaOTh1RVl5TVY3NUI5OEdFbm1IN2toZW45TDltUi1Wbk9QazZRWnpudnV6WmNxc3BmSEIwbzFuRmhSZ29pSU5jWTNkVW1vUjk0RF9PVDVTWG5rOVVJOG9DbG9IcEhuZm9fV2pfbFN1TUcyU0xQd0pmUUhCTVo5YTJkakhjeTZ0MlQwQzhn?oc=5,2026-06-22T06:51:02.749277+00:00
2026-06-21,MARKET,The No. 1 trick I always teach to build unshakeable confidence—it worked for Beyoncé and Adele,CNBC,"""No matter how talented or prepared you are, self-doubt can get in your way,"" says therapist Amy Morin. Here's how to channel your alter ego so you can do your best.",https://www.cnbc.com/2026/06/21/the-no-1-trick-i-always-teach-to-build-unshakeable-confidence-therapist.html,2026-06-22T06:51:02.749380+00:00
2026-06-21,MARKET,No one wants AI data centers on Earth. Do they make sense in space?,CNBC,"Elon Musk's SpaceX is betting big on orbital AI data centers. The public doesn't want them on Earth, but the economic case for space-based is questionable.",https://www.cnbc.com/2026/06/21/do-space-based-ai-data-centers-make-economic-sense.html,2026-06-22T06:51:02.749473+00:00
2026-06-21,MARKET,"Israeli soldiers in Lebanon are free to take action if under threat, Israel's Katz says - Reuters",Reuters,"Israeli soldiers in Lebanon are free to take action if under threat, Israel's Katz says  Reuters",https://news.google.com/rss/articles/CBMizgFBVV95cUxPSkdWNzR5aWg1SW1EZEJJOFdvZXdfa1JaVG9CcnpOUWtfREI4LUpld2JNNnQ3MEtXT1JMNTFMS3d4UHRKWC1CSm1QV1pCQ19La2U5QWlpcGNwNDV4ZnN5UlJ3TVVVbllwT0xTTjllZjIzaDFvVWxqQWZKQWJKNzAxOW55ak1uczhOV0t4UEJIekpKdWtrWjdQdGZGdUlSajNJM19ZQllzaGZldVh0TEdFS1FhSmE2M3d0dHBubzloR2tYUUotQVdxa2hZeS1mUQ?oc=5,2026-06-22T06:51:02.749567+00:00
2026-06-21,MARKET,Here are 3 big things to watch in the stock market this coming week,CNBC,"FedEx reports earnings, and the Fed's preferred inflation gauge is due out.",https://www.cnbc.com/2026/06/21/here-are-3-big-things-to-watch-in-the-stock-market-this-coming-week.html,2026-06-22T06:51:02.749660+00:00
2026-06-21,MARKET,"The best parents and leaders use a 3-step formula to help people handle uncertainty, says Dr. Becky Kennedy",CNBC,"Even if you can't control an outcome, you can still help your child or co-worker feel more at ease with uncertainty, just by how you describe a situation.",https://www.cnbc.com/2026/06/21/use-a-3-step-formula-to-help-people-handle-uncertainty-dr-becky-kennedy.html,2026-06-22T06:51:02.749759+00:00
2026-06-21,MARKET,"No-fly zone for Iran talks disrupted flights at Zurich airport, authorities say - Reuters",Reuters,"No-fly zone for Iran talks disrupted flights at Zurich airport, authorities say  Reuters",https://news.google.com/rss/articles/CBMivAFBVV95cUxNR3Y0aFE0VW1lYXZYRERxU3ZYcWFQSlQyTHcyaUhfQ3BiSlJ3cGhWOWxMNTFjNGh2SFNRTUxNLTh5MWZ4aEtlZGs1M0JfZU9ONlFzcDdGaFlISTRZVktPMmo2MS1jYlRmb25NNEk2Yk9oQWczSkVHVkczR2RwMkVFVVhsLVJzb3VXRVJ1QnljMHU2NmRoajk3TGROWkhiRGxOMHU4bHh6QkpfUE1VYjhaa0RHV1MyTnVHTExLbQ?oc=5,2026-06-22T06:51:02.749850+00:00
2026-06-21,MARKET,"Iran's Tasnim news agency says Hormuz will not reopen until Lebanon ceasefire holds, oil waivers issued - Reuters",Reuters,"Iran's Tasnim news agency says Hormuz will not reopen until Lebanon ceasefire holds, oil waivers issued  Reuters",https://news.google.com/rss/articles/CBMiygFBVV95cUxPa005aHFiRnFPT0lhdUYwazVqbHV2cEhrTWJHWFVEZDhBWlpzNEtzRFptdVZsRkpwcnQ0ZVVfNXh5aE1JR202NGpWX3liaE1aeE4ybk5oRUhwLUJFWTNPOTdfMHRxMkM5bllwRDdVcXBLbUVCSDhKTEpCQS1rcERlUW9YLTBHZEQzYVRPanVKUFlpMHo1M1hpOTdvYlp6b0lUVk5OT2FXT196RjEwZ2dBRGxpNERROG5QOFVVVGlzWGcwMU1NNWE2X1FR?oc=5,2026-06-22T06:51:02.749946+00:00
2026-06-21,MARKET,US VP Vance arrives in Switzerland for peace talks with Iran - Reuters,Reuters,US VP Vance arrives in Switzerland for peace talks with Iran  Reuters,https://news.google.com/rss/articles/CBMipAFBVV95cUxQdnAzWlotOEpfTUY1MXotSFVBTlJndkJWUS1QazZfdjFPNTFHQ3RWaFF5QjlFM3BndjQ1N0ExTlByMjNLODhTalhEb0loNTBnSmJ2OXdieURobkJ5WThHVzhwaXJ3enE4TzhzeHliaVN3bDB5SjFJa0JvNTYydEhDbW5aNmhGT2F2bFp3ZGNJOC1QZkFfWTBPQ1daS3NUbzFCVmRGWQ?oc=5,2026-06-22T06:51:02.750059+00:00
2026-06-21,MARKET,Iran coach questions inconsistency as preparation for Belgium match cut short - Reuters,Reuters,Iran coach questions inconsistency as preparation for Belgium match cut short  Reuters,https://news.google.com/rss/articles/CBMivAFBVV95cUxOMk1kNVo3MFREOWQxV2tJUmhKQktKWWI1dE50UEc5NllHakZfMU11YVRYSTFkNmVQSDVNcXpfbTJXOEdyeC03cHhxSkk0QWpaYXJmV3U5Y3FPLXhlZUFEZjVWbldRYWlPSE1TZ1Q4Sl85QlRwcTluaXUzVjJkc0JSRHpOVzNEai0wSWxhZ1JDOVN6U2xyRjhtUEY4eHNvbUFqMXRZUDhSZzdaZVZzZ3lWYlcxcF9nbF93M2Zmdw?oc=5,2026-06-22T06:51:02.750166+00:00
2026-06-21,MARKET,Belgium brace for motivated Iran as Garcia manages Lukaku's minutes - Reuters,Reuters,Belgium brace for motivated Iran as Garcia manages Lukaku's minutes  Reuters,https://news.google.com/rss/articles/CBMirgFBVV95cUxOcDRHMVQzMDJTcVhQRmFpV2g4bmJ2N1VRaTdfNXFPYlBicG1jNHlZUkxJc3VlZEwza3VIUWhRNE5OS0s2UVdOcmhENFF3WTJ2S1hJSGx1WFFXTDI5NE1zTkFCNTNVWm1mc25EOUFnQmtaa25NdXotY1FqVVUzNDNrT09xR2V3c0NiSm1fNTMzNGpJTUhTOFVWV2JsaEdOeDY0Y3c5U1J1MnQ0OWlUdGc?oc=5,2026-06-22T06:51:02.750253+00:00
2026-06-20,MARKET,Trump threatens new attacks as US-Iran peace talks open in Switzerland - Reuters,Reuters,Trump threatens new attacks as US-Iran peace talks open in Switzerland  Reuters,https://news.google.com/rss/articles/CBMixAFBVV95cUxOd3B1UzBaM0FMeEpSTFF5N3J3NXFHanp0a0VKUlprczNXWVJCa0VmSUZxY1ZqYkNPdHBrVml3clJUZzdpck1DY3djZHR6ZTFMeU5HdHVTaTJPMV81Q0VJY1E3TWZyU2RlM0ZVZDJKZ2RERnRETURQRmM4MElPajdMV3VzNW4tUEVVWDZlWG1QTGU5dHVTX2NXdjd5UHd2blpVeW5QNE91cnRnYy1vN25BRTA0RjdzMTZ4X2lQd01JdmM2SnVD?oc=5,2026-06-22T06:51:02.750346+00:00
2026-06-20,MARKET,Israeli strikes kill at least 20 in Lebanon hours after ceasefire - Reuters,Reuters,Israeli strikes kill at least 20 in Lebanon hours after ceasefire  Reuters,https://news.google.com/rss/articles/CBMiuwFBVV95cUxNbVUyY2ZiaHlmMU01WFZDX2M5c2Y3d3JWekJWMWZTbF9iR3d4UVdDR3ItSWEwSmE1M2taaG5GX2gzbTFZN3V0cUJXV1RzXzZXQ2ZmNWx1emtiVlk0Y3ZCLWQ4cVB3VFpYUmlZZUF1WmFfaUdmY1Ywa2d6MlBLakdUX0hKVzgwQWwzWVpNOXQ5TkhCYzhSVGZlSlJIc3Z6VHF1UndYd2JiMkR0T290dTVZXy1heVlwREF0Vm5z?oc=5,2026-06-22T06:51:02.750450+00:00
2026-06-20,MARKET,"U.S. defends Iran World Cup travel restrictions, says discussions ongoing - Reuters",Reuters,"U.S. defends Iran World Cup travel restrictions, says discussions ongoing  Reuters",https://news.google.com/rss/articles/CBMivAFBVV95cUxOWXZKd3Rfc2FkZHhCTEc1WWk1cjBmbm95d2xObktVdTJ4S2JtUnd1ZzMydmltY3B0SUszd3BSN25PMHdPLXBOTlEtbnJ1c1ROV21zT0tZT3RTeTFHczIxRlhUNTI3RXNmSVhNaVVwUWJEcy1BT1ZLTnhXd0sxTXB6MW9qVUFuYXlpSVI2Ni1lb3doTnA2aW9jNG9CQWxZLUc2TnVIQ21TUGdjWkZ6SElKMDhOM2UxeXJfRGVhbg?oc=5,2026-06-22T06:51:02.750551+00:00
2026-06-20,MARKET,Trump says no toll on Strait of Hormuz unless US imposes one - Reuters,Reuters,Trump says no toll on Strait of Hormuz unless US imposes one  Reuters,https://news.google.com/rss/articles/CBMirAFBVV95cUxPcTlFTUJWal9HaWxJLTBvcWZDT1BnOGlTdGxOWWdzZWMtWlpsTXQ1V0NLVVFXY29oSGxwRVotLVFMU2ptbS11M21nM2pSdExIM1E3OTFSUTc0d0xqeEZCblZtb0VHOEpPWXhzN2NDc2hvXzZ3bGFZSHlKak9VeUVIcElMSk5IcXlfZlh1QTh5emxIT25yQVRMZ09GOHduTDFkVFRIWkZuaXZLZjNK?oc=5,2026-06-22T06:51:02.750653+00:00
2026-06-20,MARKET,US forces monitoring Strait of Hormuz to ensure it stays open - Reuters,Reuters,US forces monitoring Strait of Hormuz to ensure it stays open  Reuters,https://news.google.com/rss/articles/CBMirgFBVV95cUxQOEt1ZGR5cFBKRG1mSHlLQTc3TnpyMnVnaWltNHQ1eXpockxLYVhxeVlqdmRMeThjck83dVdad2s0eTJOblROeE1GNkJWeF94RTE3cEwyNEFSWTVIaTZITHAtbTNMeS13dmtXUFZrUzJHZjNMdW9ReHZpOFhELUJaX2hNU1BLblRBYno3UHVBT1djajVIdlVQQ1hGb0RuR19wZHA0dUZXX1VrSlJPQVE?oc=5,2026-06-22T06:51:02.750747+00:00
2026-06-20,MARKET,Big tech stock buybacks vanish as AI spending spree eats up cash,Bloomberg,"Big tech's stock buybacks decline as companies prioritize AI investments, shifting from capital-light to capital-intensive strategies.",https://www.bloomberg.com/news/articles/2026-06-18/big-tech-s-ai-spending-spree-is-making-stock-buybacks-disappear,2026-06-22T06:51:02.750844+00:00
2026-06-20,MARKET,The budget airline model in the U.S. is running out of runway,CNBC,"Spirit's bankruptcy as United and Delta fly high suggests there's more to success in airline industry than low fares, and failure isn't about jet fuel spikes.",https://www.cnbc.com/2026/06/20/cheap-airline-fares-summer-travel.html,2026-06-22T06:51:02.750935+00:00
2026-06-20,MARKET,Paris police arrest 20 as demonstrators defy ban on Iran opposition rally - Reuters,Reuters,Paris police arrest 20 as demonstrators defy ban on Iran opposition rally  Reuters,https://news.google.com/rss/articles/CBMirgFBVV95cUxPemJad0VoZTdPSXlzRG41S2tQd1pXaFZLWXZvejJ0YlVMa0p5Q2ZBV05SSGxONHhvUHZGWWJUd2prZ3FXa0NFaEQxN2NsR01fRlVpRDREQTg1R1U5S05sR3NvVkN0LXM5MmdfNG1Cb2FWbGo0Rng5RV9Sa1ZyY0pDT21CV2NhRGJPQkhmSGNaYmc0NHJMNXZYQ2NfQThjRlNIY2d2VndGRnAwUTkwNnc?oc=5,2026-06-22T06:51:02.751028+00:00
2026-06-20,MARKET,Iran closes Strait of Hormuz over ceasefire violations - MEHR - Reuters,Reuters,Iran closes Strait of Hormuz over ceasefire violations - MEHR  Reuters,https://news.google.com/rss/articles/CBMirwFBVV95cUxPaTEyTUU2Snk2NzBhWmZCcV9JMzlEV0hRbjNTU282RU5wV3FvNElISFk2ek5SaXU3YXJXR3l1ZFF2RGpsMElnTkpMUmc3Y084NldTRndXWGdLWDJuT05wd0JkY3VtSUxKdFZMLXdJYmVMZXROV2NOczE3b0pWNEZpaEN1UU1teHZyWmotTjdtNmU2RHRlVmtkMzNoZUN5aGpFZHhnRVRnanVxYkRtSnVz?oc=5,2026-06-22T06:51:02.751147+00:00
2026-06-20,MARKET,"Switzerland says US-Iran talks continue at Bürgenstock, declines to identify participants - Reuters",Reuters,"Switzerland says US-Iran talks continue at Bürgenstock, declines to identify participants  Reuters",https://news.google.com/rss/articles/CBMiuAFBVV95cUxPRDVvaUdiWWJuc1RxSXoxbnpGSXRFVVZJOHZmOU5CVWtEM3FUcVNLN0RkdHYtLTBndXNXU1RtbklqZUxUaW55LUR4dk1qRHlXXzZyRHgzM3JleV95Q0ZJN2ZmaTBsWkhmSlZPaDFtRmV2dmNzUWFrTG9mNFFNVjhadU9WVWstTTZNeVZjY3NkTWFoN0V5X3JGb1pybVVGb1NZaHMtNElLZklFV2h0a3l4VUpFalBDN1Vk?oc=5,2026-06-22T06:51:02.751238+00:00
2026-06-20,MARKET,Iranian Guards' business empire to win big if U.S. sanctions lifted - Reuters,Reuters,Iranian Guards' business empire to win big if U.S. sanctions lifted  Reuters,https://news.google.com/rss/articles/CBMitgFBVV95cUxQeTVOWlpubWVJN3A4Rl9Wai1TNWRycWQwS1RrbXJCQndDZXIxaklsWV9idkhkRXI2SmN6cldIelBCNGVJNVNYWXhmUjNzeUx1VWhDbkNTdVJLNmwweUtzNmpobW5DSHNVc1BQM2xTc3plMzBpNVV6akI2X1AtVGkyN1l1Q0VIanZGNkctczJvSFM0WEtTdnZmNFlLdWg2LTVtUUxYTC00aEs0cG5qcERYSXBya1Y4dw?oc=5,2026-06-22T06:51:02.751343+00:00
2026-06-20,MARKET,"Iran negotiators, Vance head for Switzerland but Lebanon fighting continues - Reuters",Reuters,"Iran negotiators, Vance head for Switzerland but Lebanon fighting continues  Reuters",https://news.google.com/rss/articles/CBMiqgFBVV95cUxNMmZyRmRQdUo5dlpLWnZaTEVkV2JBOXpMS2hNTEg1LVN6YzN2VjNlMXZkNXlNdVY4bWhaMG0wd1JtVWtmV1BNbXk5UjNHODNLT3ZJZUNfcmFZSmVvWkRfQ2J2eHNoZGRiWUpwbGZBT04zbjBILVZoV21rUC1VU2pWeENyaDJNRGMtY2otYWV5eG1fdjc3RFhFNmNCQzkyTWJLRVhVbjhFZWhfQQ?oc=5,2026-06-22T06:51:02.751430+00:00
2026-06-19,MARKET,"With Lebanon ceasefire set, Trump envoy heads to Switzerland for U.S.-Iran talks - Reuters",Reuters,"With Lebanon ceasefire set, Trump envoy heads to Switzerland for U.S.-Iran talks  Reuters",https://news.google.com/rss/articles/CBMisAFBVV95cUxNdGlIRzVkQXRyMi1KZ2xpUGFScEtiNlk2M2VjV0t2M0xsY1NYcFJfQXNxSTFDSXFjaXZmNDVMWkVvU00zX0tXTE80MXpFUlVUeE8xOW1USzJtTERYV09YRU4zbnRic1NwaG1WRHVRT2s2TTl4NkgxMjNVMEtsS0pyQl9ldURhQVkwTzdzcG5sajE3bzhSS1h5NWpoWDJZd05HdTFodHd6azZjN2JLT25xaA?oc=5,2026-06-22T06:51:02.751517+00:00
2026-06-19,MARKET,Israeli envoy and UN official clash at hearing on children in conflict - Reuters,Reuters,Israeli envoy and UN official clash at hearing on children in conflict  Reuters,https://news.google.com/rss/articles/CBMioAFBVV95cUxQSWREYzZJVno5TDBkWG9GOVZTLVFIQWpkdUN1enNFZ0d0ZmpoUGg0NVlaTnBmT3RxempzMTUxRjZVTTBYZkNHa0ZBdklXZFNlbjNUeEFwN1pRN01JQmFneFpVeXZWekN2SThDUWlncjhCX3lvREFxb1NHcllPeDFFU05ibXJkUjNYbWFhWi0zejhWbGdoWVdiWlVvX0I0MWUy?oc=5,2026-06-22T06:51:02.751609+00:00
2026-06-19,MARKET,Belgium face Iran in pivotal Group G clash amid travel row - Reuters,Reuters,Belgium face Iran in pivotal Group G clash amid travel row  Reuters,https://news.google.com/rss/articles/CBMiqAFBVV95cUxQdVpZSGNpLWdnR0gtTjN4Z2NNc1R4LWZqNEZOVHUtRDNjU3d4MzlqLUtPVjRXSFdIQjUwNkNFNzlfd04tVlJ0a1cwYVZUalVrZF9FWkN2dC1ZVlkyVVAydUlNTUhYYjg3QV9sYjBGdUltUHVTRksyV0x0ejVUSEJGYllST0JoMlpTU08wcmJFMmhhMk1YVmw1aGx4cU5Xc25QTkVMYlNJWmk?oc=5,2026-06-22T06:51:02.751709+00:00
2026-06-19,MARKET,"Israel, Hezbollah agree to ceasefire in Lebanon, U.S. official says - Reuters",Reuters,"Israel, Hezbollah agree to ceasefire in Lebanon, U.S. official says  Reuters",https://news.google.com/rss/articles/CBMisAFBVV95cUxPMDU0b09vektQdnBEbFN3LXFOMjFUQk0ybEdGV3EyZnpibE13akNnNzVVVHZjRkZIX1ZjYjBUM0ZHTTNSdTVWWTJPTGpGQkJhMndMWDFqYnQ2Zjg2eEVPWm41Q0otVmhvRHZTOUo1MEx5Zi0zd3JINUZXb25fVFBONHJhUHNoT3VPTWxlYWFfVDlwY0htS0FfMnpBWkIwSWoxNm9HTFZieGF0RmtsMjRmZQ?oc=5,2026-06-22T06:51:02.751804+00:00
2026-06-19,MARKET,"Brent set for 8% weekly fall as Israel, Hezbollah agree ceasefire - Reuters",Reuters,"Brent set for 8% weekly fall as Israel, Hezbollah agree ceasefire  Reuters",https://news.google.com/rss/articles/CBMipwFBVV95cUxOcG8wSGhHblhWdlppN2pVNUt0WFExeHM3a2xOS19weUVYRmEtSnQtVlRMNnBxY0hoZkF4b181N0FmTTQyNkFfYTduYUJHSGlreF9vSC1Ib1RPRFU1RERHRngtYWUwTEt0ZkpPSFdlOHBZMF9BN1JMenpYTzcwZ0RzOENHQ2Q1VTc2R0poVWdaTUNLc1lJbjMzRmttWW9LOC1FMWtHU0ZlTQ?oc=5,2026-06-22T06:51:02.751897+00:00
2026-06-19,MARKET,DOJ rebuffs judge's request to put in writing it won't move forward with 'anti-weaponization' fund,CNBC,The DOJ in May announced it was creating the fund as part of a settlement of President Donald Trump's $10 billion lawsuit against the Internal Revenue Service.,https://www.cnbc.com/2026/06/19/doj-anti-weaponization-fund-trump.html,2026-06-22T06:51:02.752003+00:00
2026-06-19,MARKET,Trump heads to Camp David as Iran talks falter - Reuters,Reuters,Trump heads to Camp David as Iran talks falter  Reuters,https://news.google.com/rss/articles/CBMimgFBVV95cUxQanZjcWNWV1diQU5BSFRBUzJtMlVJVDhWSjZ6MXc5S21QVlF1NHVrM0hTdjJ5dEJrQjA1QXMzNHNPTnpySW00XzJfbXBhNXZUN1RHU1UySWFLRl9SdFA3WTVMWmZNaUtPNmZxTGlIZnN0ZUtCVUZVbTBsZ21FVWR3dVJ4WlZCbHpGcHczdXcxVURpQnNHY1JBVTFR?oc=5,2026-06-22T06:51:02.752115+00:00
2026-06-19,MARKET,Fedspeak vs. war deal: Here are the things that drove this week's stock market,CNBC,"The S&P 500 surged on Thursday, making up for losses seen after central bankers convened.",https://www.cnbc.com/2026/06/19/fedspeak-vs-war-deal-here-are-the-things-that-drove-this-weeks-stock-market.html,2026-06-22T06:51:02.752201+00:00
2026-06-19,MARKET,"Iraq to export crude, naphtha through Syria after Hormuz shock - Reuters",Reuters,"Iraq to export crude, naphtha through Syria after Hormuz shock  Reuters",https://news.google.com/rss/articles/CBMirwFBVV95cUxObjFTV0lGXzVST2l2Y05WQ2Nkcjl1OUM3NHBvMVFER1IxTlQ4V3JCZ2tVZmh0Zm51ajZJb1dkTWo5OHNOT3ItQ3VoNFB6YlZnVXZUTEdlYnBBb29KSU9IWHV3RkpRallIVkh3bkdXWHRKVFRJRGFoTi1YMnllbllLTjkyLURUNFJ1YU9kRm9JSXB1b1ViZW1FZ3JhdHA1elBoOHBYb2EzRXZrVXZaMFhn?oc=5,2026-06-22T06:51:02.752301+00:00
2026-06-19,MARKET,29-year-old making $250k in tech went 'undercover' at a coffee chain before opening her own matcha cafe,CNBC,"Michelle Yeung wasn't happy in tech, despite earning $250,000 a year. Before opening Matcha House, she spent months learning the business.",https://www.cnbc.com/2026/06/19/29-year-old-software-engineer-worked-undercover-at-a-coffee-chain.html,2026-06-22T06:51:02.752412+00:00
2026-06-19,MARKET,"For US Vice President JD Vance, Iran talks could shape political rise - Reuters",Reuters,"For US Vice President JD Vance, Iran talks could shape political rise  Reuters",https://news.google.com/rss/articles/CBMikgFBVV95cUxOQWlnWFI3SUZDeUtiRU9JdURpYTJhMkM0Qzdzay01VGNKbFBXRDdNZURuX2h4TFNrdGVhYlF0QVcxaHY0cG5FNTIxSVRpVG9yOENHbnF1M2ZJRkpYb01kdUg5YWlhRHljMXhBcll5d2xNLTVaQXZQZDh2LWZhcU9TREVLYnl5MDUtdVQtdVlqOUQyQQ?oc=5,2026-06-22T06:51:02.752501+00:00
2026-06-19,MARKET,"Israel, Hezbollah agree to ceasefire starting on Friday -U.S. official - Reuters",Reuters,"Israel, Hezbollah agree to ceasefire starting on Friday -U.S. official  Reuters",https://news.google.com/rss/articles/CBMitgFBVV95cUxQNVlqdUp2WDdfZkNqcDlJbkVnTTh5aTZITlJaYkVUd0NEQl81b3ZodFZleFV3em5mRldLdWUySURpd2N5ZGlQREdRWDlUcUZCVHdmQnhNN3VvS21NRDFuQmZMb3UtSEFSaHY2YVlxV2NkMGRQVTA4SllfczlrVGVCaE1ibkhXNmlsZl9xQlcwTG1vYXRIQmp4bFpoZkFkZDNRTk9KdDlsbGg3NWs5cFFoVUk0NWZZUQ?oc=5,2026-06-22T06:51:02.752587+00:00
2026-06-19,MARKET,Shares ease as investors ponder US-Iran peace talks; yen nears 40-year lows - Reuters,Reuters,Shares ease as investors ponder US-Iran peace talks; yen nears 40-year lows  Reuters,https://news.google.com/rss/articles/CBMigwFBVV95cUxNZGh0dzZrMVhwME55Z1FPXzBZRjQ3LTVFS2xaLS1hMlNRUUNWN1A0Wk1qVXVKYlRhNEY3X2lMZVVKWnF5UHMxWU5yUkhJdmhBODZFNnFDYXFYYXRkT25nQ1FTRWZIY00xTFRaX2t3TjcwOGxUV05LQTdBVVplSEFpeGN4VQ?oc=5,2026-06-22T06:51:02.752681+00:00
2026-06-19,MARKET,Oil shipments rise in Hormuz although questions grow over Iran's transit terms - Reuters,Reuters,Oil shipments rise in Hormuz although questions grow over Iran's transit terms  Reuters,https://news.google.com/rss/articles/CBMixAFBVV95cUxONmxOVHFxZFJqT0MyRms0akxNMzFSVG45ZDFFVHFjZkZrMmh0anBuak5MYjlwWWw3Vy04LWl1b3oxbnZHSGRqQ2V0cWN5WUhxbHpZdXRCQmdpZGpsUk40RWl3dlVyTWtTUTRQOUtjbHM4NUJtTlpwZWtMMmx3REpQMWl6OWJEYzVhSHpIVkVicGVSdzdiaHd6WkU4ZENSaWZlUVVVUFNXYTktZDRDSVdZMmRuWXhPWFBBS2RLMk01OEo0eWFy?oc=5,2026-06-22T06:51:02.752783+00:00
2026-06-19,MARKET,UAE bourses decline amid US-Iran truce uncertainty - Reuters,Reuters,UAE bourses decline amid US-Iran truce uncertainty  Reuters,https://news.google.com/rss/articles/CBMipwFBVV95cUxOdWNoeGxDdFJVd2w1ZWg1Q29Wb1ZfZDkyT0RiMGhaMlU2UDZxeklhRVpXdlMyc0lPSE5MNFlFOTFtOFJsNVJ0Z0Q3YmxYbzlWRWlkbmZjVlhybVktbjZSRmd1VURlUHh0X0xtTDVreldBWng2U1hmZzlPZUJJdTNDby1UVnBzMmx4UkpGcDFEV1o1RFYtTVJGMWRoSERQRFlXRnZvalFYYw?oc=5,2026-06-22T06:51:02.752878+00:00
2026-06-19,MARKET,Iran to lodge FIFA complaint over World Cup travel restrictions - Reuters,Reuters,Iran to lodge FIFA complaint over World Cup travel restrictions  Reuters,https://news.google.com/rss/articles/CBMirwFBVV95cUxPR1VYU082ZUFSeVhJV1cwcWhtajVlaWVxc1ViSFhOS0wwXzRfazlXNkxUbGtqMGZOa0FZVEFQWFZ6bktXc2o0OERiMDVrVnJuWGlSUEZvSHg1ZjVJczlBU0VpMzVob1p2anJRWTVhUnVXQWpRX041Q25GLW5SVmFiYjc3aDFVaFlSdF9EbHd2NGtEdm5URVBZckZXeGIwdWFvOTYzQ2FuUUxtdUFwTFdr?oc=5,2026-06-22T06:51:02.752977+00:00
2026-06-19,MARKET,"US equity fund inflows surge on Iran deal, tech draws record weekly investments - Reuters",Reuters,"US equity fund inflows surge on Iran deal, tech draws record weekly investments  Reuters",https://news.google.com/rss/articles/CBMivAFBVV95cUxQa2IxeWNvMGtLVFlFUGpoRG80NWMyQk54bFloejRqWUI5NlBlZlUtaFQ4UWxsMHNEQlF6ck5EN1BwTVRCeWR4Q1RmcXZiY1Y1QUNOUzVwbDJobEU3YUc2LVFDczQ2RlhMTzBlQnFCc2hOc28tNzJtbjJBV0JiY0R3aTd1TWd0SkgxS1AyUVA2QVgxUndFNFhDTVkyTDgtMUFLaHpiM3VPY2xQZHdadXNVM0U1eFNvQjhsVm1rTA?oc=5,2026-06-22T06:51:02.753063+00:00
2026-06-19,MARKET,Iran says it will waive fees for Hormuz during 60 day negotiation period - Reuters,Reuters,Iran says it will waive fees for Hormuz during 60 day negotiation period  Reuters,https://news.google.com/rss/articles/CBMivwFBVV95cUxOUXNFdk9kOGRINmxCdTJYVm9wX0p1NF9TUWF0NHJKX3V5UVB6am05Q2FMUG5DSWl0SVd6N2ttN3h6TG1paE83VFRZelhGcGZqcG1BZDQ3d2xxd3JwQWlURFl0Yl9KcFVNeWMxVkZySW5jRHItWDEtNXJGMFJ2d2c4TXB6ZUluZVY0bUhSaDloeEk2QTdZVDB5V0I1RWhWZVRpYVRqcGcxeHBPTC1IMlJNa3Y5bWlWTWlScnQ3NzNlOA?oc=5,2026-06-22T06:51:02.753150+00:00
2026-06-19,MARKET,Bob Iger reflects on 10 years of Shanghai Disneyland as it defies the Chinese pullback,CNBC,"Shanghai Disneyland hit 100 million cumulative visitors in 2025, according to the company. It's a relatively new but important foothold in Disney's history.",https://www.cnbc.com/2026/06/19/bob-iger-shanghai-disneyland-chinese-pullback.html,2026-06-22T06:51:02.753235+00:00
