Date,Ticker,Headline,Source,Summary,URL,FetchedAtUTC
2026-06-19,MARKET,Police order last-minute ban of Iranian opposition rally in Paris - Reuters,Reuters,Police order last-minute ban of Iranian opposition rally in Paris  Reuters,https://news.google.com/rss/articles/CBMiswFBVV95cUxPMnlWZEZ1VlJuWWVZUXI3Uk8xNEZPQ1BsQjZnZEhNQ2w5cmFYT2FzWWdMN0std29icklNbXFUWGRqc0s5aXJYbFo3ZHhLb19VZjVsbUZLOW11dXQ3S2NyRmFWcWRTNy1NMHAyR3NsNUNLTGRNNTBabldUUi1EUS1wYjZxSW5ScmpQRmVsczdUZjd1LUE5SXBuNGUtVXliRVFkWVdnUUJhT3pMT3N4cHdWQ0VYSQ?oc=5,2026-06-22T06:51:02.753320+00:00
2026-06-19,MARKET,Weekly inflows into global equity funds hit 19-month highs on Iran deal optimism - Reuters,Reuters,Weekly inflows into global equity funds hit 19-month highs on Iran deal optimism  Reuters,https://news.google.com/rss/articles/CBMiggFBVV95cUxQT050dkJmNU12bDgtelpJUzA4X0ZuRHBLUktYV2dGbXVoaG9rd0R5V3hkWGd3dUY0R0NvQ0RhMExUM3luT2RENHRMcmlqTm0zOVdsc3NtcFdibWxjSWZDMndzM25DWHJPOFNkQ1RSRWZ2cktBYXkwT3ZJWlpVSEhrTkZB?oc=5,2026-06-22T06:51:02.753405+00:00
2026-06-19,MARKET,France's foreign ministry denies asking for ban of Iranian opposition rally - Reuters,Reuters,France's foreign ministry denies asking for ban of Iranian opposition rally  Reuters,https://news.google.com/rss/articles/CBMivgFBVV95cUxOOU53S1haeDNDTFFSdVVZVzZhQ1BoanBCT3MtYnE0UFlkRFRLdWg3RWNLSHhLblcwazlDdEs5ZEc3TVpoT3NCN1Q0a3hvZGVlUnJTdFd1Vm9lalNodVlJTmxULWVEWDJEemdUQkkxTHoyM3d1ZUVuWlhqTkMtak1EX2lPNG5xYnlOcmxlZWU4aGxDanRzWnBIa0RIYW9mSXpZeGhWSl9vUGlPNXJicnVDdlRwQ0ZwcFh1cC0wSGdB?oc=5,2026-06-22T06:51:02.753490+00:00
2026-06-19,MARKET,"No UN sanctions lifting on Iran without France's approval, foreign minister says - Reuters",Reuters,"No UN sanctions lifting on Iran without France's approval, foreign minister says  Reuters",https://news.google.com/rss/articles/CBMiyAFBVV95cUxQTFpEdmJrUXJmcHhZcmRrYTk1SlgzOE1fTjlCWjBiZHNkN204RVlRbllNUVppeGhnaHNKX05TYVhILVM1TEZWcm0zRnMxdUlYMGR2UWxaUzlqcVZWMll0SUlETU4zcmZCLWFYOWhzNWl4SDNaYXY2ZVRIMmlNNFIzUTM1bHlnVHRIS09pMzJEcU45bEN3N3pSZkVLUHZJZ0ZOal9MTzhiN0dEMkI3NTNQT2x6WXlET2ZjY2VoUU0wTnFLTDg2bWZkVA?oc=5,2026-06-22T06:51:02.753584+00:00
2026-06-19,MARKET,"EXCLUSIVE: Iran's Revolutionary Guards set up covert Iraqi cells to attack Gulf neighbors, sources say - Reuters",Reuters,"EXCLUSIVE: Iran's Revolutionary Guards set up covert Iraqi cells to attack Gulf neighbors, sources say  Reuters",https://news.google.com/rss/articles/CBMixwFBVV95cUxOdVVhdU1ZeHBCU08wQ0tpY3l4MXNnQWVaeFRzakJETHVFV2Q0Y2c3eTc3WjRKaVJBWTNUNkpncjh1WmQ0eFM2LTc0YzZfZzYyZlFwOW9TQ0V5S2cxalFaTWlDUlhrMDBaWU9uV3o5WXZsQjVSREFrQlNHQXNGX2lSbU1FSllXR2pKWFM1M3M2amJjZ0EtUXQtNDRTbWVtMFBuUDU3MUJKdTlDcWhZZ0pNQWRQa210ZVBmNXJmNnM5REM2NGt3eXpn?oc=5,2026-06-22T06:51:02.753681+00:00
2026-06-19,MARKET,"Stocks climb on chips, Brent gains on Iran deal doubts - Reuters",Reuters,"Stocks climb on chips, Brent gains on Iran deal doubts  Reuters",https://news.google.com/rss/articles/CBMigwFBVV95cUxPQWc5blRuNGVXLWNEeGRWUHBJTi1tNG1oR2wzR3R0RXY1dWdVS3JVMmRRSlI0NEgwZUpVNTNLdUphd1Q4OGpXSmtSc0lwVmNONzFpYWZFVG05OFQ4Y1JtaVAyN0lCblhSVEUwZ2RDTUx4eTFzWl9SR1NVT1RvTGxwSTg0dw?oc=5,2026-06-22T06:51:02.753765+00:00
2026-06-19,MARKET,"Tax cut pulls global bond funds to India, backing rupee",Bloomberg,"Overseas flows into index-eligible bonds have increased by ₹32,630 crore ($3.5 billion) since the June 5 reforms, according to latest available Clearing Corp of India data",https://www.bloomberg.com/news/articles/2026-06-18/pictet-neuberger-to-boost-india-bond-exposure-on-policy-support,2026-06-22T06:51:02.753855+00:00
2026-06-19,MARKET,ECB’s Wunsch keeps July hike in play even as Iran deal eases energy prices - Reuters,Reuters,ECB’s Wunsch keeps July hike in play even as Iran deal eases energy prices  Reuters,https://news.google.com/rss/articles/CBMiuwFBVV95cUxNR19reWNmVi02Qk1nNzJyVTZWTzRZUEtFTzlnd0g1NlkxODJib01Ua0NydFp0N1VoSGsxRm51azdMd09IMm9xb0NLWGU5cFVleFZKR0pHcGtWRklUOVZjSkRudnlPR1BkOU5ORnZud1hrYkhoNUR0aUVudE9pR1RnVENmUlpfcWVEemtkVmFTQmZkVUlncGhVSXRlWTRzWGxxbUZweV90TTUzMGtRME9VZ0o5RjhoS0JJNXQw?oc=5,2026-06-22T06:51:02.753951+00:00
2026-06-19,MARKET,U.S.-Iran accord hits early snag after Swiss talks fail to proceed as planned,CNBC,Analysts reckon a lasting resolution to the Middle East conflict will take some time to materialize.,https://www.cnbc.com/2026/06/19/us-iran-talks-switzerland-canceled-interim-deal-markets.html,2026-06-22T06:51:02.754043+00:00
2026-06-19,MARKET,"US-Iran peace talks in Switzerland called off, clouding prospects for lasting truce - Reuters",Reuters,"US-Iran peace talks in Switzerland called off, clouding prospects for lasting truce  Reuters",https://news.google.com/rss/articles/CBMiwwFBVV95cUxQLW9pazRsVVhsZUZKVDZfWDF6SFhUdDFJMkJ6Snk5bDgtN3JpMC1WUTBmdWN1N09Hby1TOGRndFRhSW1kUUJRTjd5dXVqMWdnbUdwXzFiREp4WVhGN2l1aE5BaFd0RThIUXU3WjRqN190R2xRMFRZZ2IxN19ZSFNIQXhXRmZmdndmcExjLWJOamVpRnZRSnd3aW1jREY4UXNaMVVTR2VpYU9YRVR0RE1EQW81bTFad3FsamZ3bFczLUszSU0?oc=5,2026-06-22T06:51:02.754128+00:00
2026-06-19,MARKET,"Pentagon tells US lawmakers it needs $80 billion for Iran war and other bills, WSJ reports - Reuters",Reuters,"Pentagon tells US lawmakers it needs $80 billion for Iran war and other bills, WSJ reports  Reuters",https://news.google.com/rss/articles/CBMiwwFBVV95cUxQV1F4TXZTZ3VSNGItWkdaX1Yxc0FRZDR2cWR5VVNjVmJNS0lpb1B3dm1JMk0zaVZwWDcyMW83VExiNUNBTnZ0M3JRTDhPbGZwWnJpeDRVNVloU0N2RF9ndTdtNzBxSWRiWkhYb3QybXhVTklacmZFeGV0dXlDdDNVMmRUOWlmSFNrbDlfcGotWXhwclBDVGdCVWhaeHEwdzBJSGFvb05Qb2djZlNDc3ZPR3ZUdGRPcm1zZm9JWXVZZTZtUzQ?oc=5,2026-06-22T06:51:02.754213+00:00
2026-06-19,MARKET,New Zealand's Singh proud to blaze a trail for Sikh community at World Cup - Reuters,Reuters,New Zealand's Singh proud to blaze a trail for Sikh community at World Cup  Reuters,https://news.google.com/rss/articles/CBMisAFBVV95cUxPNlFuaThfZzJfR2sxZzZtZ05hc2FhZU5uenJMSmh2a0FYVzBTWEE0cWtGcmxqcEZjYkdnS2FYb0dkTkNxekw0eEpLd20yM0hvMjVEOXRDU3Q3eF85LXRVb19CQ0pvMURQTmhTdmhDY0ZyYXVMSlV1bXNKREMxajl3UktjWTk2UDVwWXhMQVVWdkpvSUZUTjhyQVJyWEd1dGdUVWJZSDhqclRIZmhkaDU2TQ?oc=5,2026-06-22T06:51:02.754299+00:00
2026-06-19,MARKET,Gulf airlines get back to business as flights near pre-war levels - Reuters,Reuters,Gulf airlines get back to business as flights near pre-war levels  Reuters,https://news.google.com/rss/articles/CBMiswFBVV95cUxOdThBbGpuM09BY1RmV3RZR082UmZ3WVg0RnY1Nnl2TXFtUWdtYUxvVkN5M2MzZ0I5aGxQNlFMZnBiRnQ3X01mMFoyLUNqLUE3YVJZcjBRMUxoVDR5OU5IQm9HR2ZCNjhPZDFkQ280S2hfQ1NMcmszWWpNX09vdDN1QVU4cjNNWnltYl83TXl0RzVGZ25lcVNES2NJd0ZuR1JZYkx4cHpPc3M0dzhZZUV0eFhsVQ?oc=5,2026-06-22T06:51:02.754380+00:00
2026-06-19,MARKET,Switzerland says US-Iran talks planned for Friday are off - Reuters,Reuters,Switzerland says US-Iran talks planned for Friday are off  Reuters,https://news.google.com/rss/articles/CBMirAFBVV95cUxPTlJqR2FGdGpULS1ZUTYzTEQ1UldELWIwa0hIOHJWRU5nZUswcXVjRkZRM1R2bW81Y1I2VzZxbHBlVlQtQlVpYm50ZDZzV1VmcjhpbGYyNmNVSnQ5SU8wLUI3QjQ5cnlWbzNJX2hZaTN0cXRIMGwyaWZVbnJ4RzRDRU13QUVhRlA4eno0RGJGblBGai12VzBwTGR4VzJaaHJpYXZXalh5Nk9TbGFL?oc=5,2026-06-22T06:51:02.754459+00:00
2026-06-19,MARKET,"Short-bond rally faces risks from cash drain, analysts say",Bloomberg,DBS Bank Ltd. expects the central bank to deploy a stronger tool in August by requiring banks to keep a larger proportion of deposits with the RBI,https://www.bloomberg.com/news/articles/2026-06-19/india-short-bond-rally-faces-risks-from-cash-drain-analysts-say,2026-06-22T06:51:02.754550+00:00
2026-06-19,MARKET,How Trump's deal with Iran compares to Obama's - Reuters,Reuters,How Trump's deal with Iran compares to Obama's  Reuters,https://news.google.com/rss/articles/CBMimwFBVV95cUxQbV9DV1p2OVVQRlVSYmRFYWxGd0lfcFFYamp1M1pGRVluaDB5Y2QyMVhKSERSVW9GM0ROOUNRUk1UVXpIaThfYnFvcHowazdUMWxkVWZSWEVaeUJvQUowTlR2SUJuMGdBUFZMeVdXVDJOT0xydWZoNUY0WUxPeWFadUdvbkZWZkhPTXVVTjdQNGZLNDdmOG9iellKYw?oc=5,2026-06-22T06:51:02.754620+00:00
2026-06-18,MARKET,Brent rises after Vance warns Israel against breaking ceasefire - Reuters,Reuters,Brent rises after Vance warns Israel against breaking ceasefire  Reuters,https://news.google.com/rss/articles/CBMilgFBVV95cUxOZU5Zdm80MlhXLVFYajFEdy1GcU9zNGNaa2FvM2ExTmZkZXJieS10V1ZjQ3NqTndMcG1hT1hpb0FGYTN5M1ZMY2VFRG9QNDZkVGhxVEJTcUVpakJGQWNtODJYOTJpSFJOM0hwN01DT21ZaUxKN2FBa2czX3ZFUHlTMXpuUnZpa1dNOFUtOXFFaUx1LTJwN1E?oc=5,2026-06-22T06:51:02.754689+00:00
2026-06-18,MARKET,"Wall St indexes advance with boost from chips, Iran optimism - Reuters",Reuters,"Wall St indexes advance with boost from chips, Iran optimism  Reuters",https://news.google.com/rss/articles/CBMiwgFBVV95cUxNbk9OU3cxZnFJZTJuS2dhU3hka1hTQjc0ay1fMUgzTHl5cnhpb2F1NzUzbEkwTmQ1TzkxWHJscTJKVGRkMEFvdC1ieXJ1RDhWVjRvNERsaHdwUVBROEE4ckpaaUwyY1I0RlJwMVRDWFBSd1BmYkF0OC02UXIxMXFwSFU2RGNpd1hwNG9lN1NqbWVMTlhRUUhkVk5jdHN4MVhfRXpnZkdXYUFiT25WOWVndVktRVBNUHY3WjQ1SkNDeWFNZw?oc=5,2026-06-22T06:51:02.754769+00:00
2026-06-18,MARKET,Republicans blast Trump's Iran agreement as details emerge - Reuters,Reuters,Republicans blast Trump's Iran agreement as details emerge  Reuters,https://news.google.com/rss/articles/CBMinAFBVV95cUxPa0FBNEpEUk9sRDhBMkp2bERRNEtLX3oweFJuTlM0ejdMZDZhX2ktUlg3cFk3TWc3aVcxc0xFeVlBTzg4eGZBMHNNS2dHbW1YSFJkZXYtZ3FGNWhKeTlZSU9KVWR2ZXphRlJjWk11ckFwUDM2cDM3Mm5rRk14ZkxoNEp3Qy1kdUR6OEFnczJHZzdhTUJUbW9LdGRGV2s?oc=5,2026-06-22T06:51:02.754851+00:00
2026-06-18,MARKET,"Trading Day: Stocks rally, oil hits pre-Iran-war lows as Strait of Hormuz reopens for business - Reuters",Reuters,"Trading Day: Stocks rally, oil hits pre-Iran-war lows as Strait of Hormuz reopens for business  Reuters",https://news.google.com/rss/articles/CBMipgFBVV95cUxNWi11em9BSXkyTVBsZ09QdU5zS3lZTUh3TE1kV3VCanhVOTdYaDlqamZvRmlNaERYdzZ6ejdZZ3M5TUUzNWlwaE5teGdpOGdVVmlyOHR6SFJ4eF8ya2dpaXlCb01kMVB1Sm92VVVaRzVDVFhVMHBOMlBvRjQtWXk3T0EzSTdZdW96bm1IN3h4aERkRXotb2tmeUd5T2dvZllJVjFhM3ZR?oc=5,2026-06-22T06:51:02.754921+00:00
2026-06-18,MARKET,In photos: Star-studded crowd gathers to celebrate the Obama Presidential Center dedication,CNBC,"Barack Obama opened his presidential center in Chicago with former presidents, celebrities and dignitaries in attendance. President Donald Trump was absent.",https://www.cnbc.com/2026/06/18/obama-presidential-center-opening-chicago-photos-trump.html,2026-06-22T06:51:02.754989+00:00
2026-06-18,MARKET,"Gold slips as hawkish Fed signals lift dollar, boost rate hike bets - Reuters",Reuters,"Gold slips as hawkish Fed signals lift dollar, boost rate hike bets  Reuters",https://news.google.com/rss/articles/CBMingFBVV95cUxNa254NGd0TnM3NEliRVJYV2J3blZ4NzZ0b1dhMEMzSE9YWG9qQ2xmSzE3WHN1cEV1WXVrVGkzcUhFQVVnZXVtT2cyejY3UzdLM3JtRVlzaVpWNzNDZXdzOHlveGk3Wm13aXpaQVVTVnZYT0xZRmxHcXJtNTlsOEFYeXJaWEdKeHR0MWVnT3hJNkRYbFVCUEJEM0RCbjd6QQ?oc=5,2026-06-22T06:51:02.755059+00:00
2026-06-18,MARKET,Vance warns Israeli critics over Iran deal: Trump is your only ally - Reuters,Reuters,Vance warns Israeli critics over Iran deal: Trump is your only ally  Reuters,https://news.google.com/rss/articles/CBMixAFBVV95cUxOQXNyRDhPaS1YLXpCcE5sWnNCNWdCMENzLUI2bnk2ZkpteXZOWGpNMWVUeDZTR3M5WW92bnpIS3l1dnF1czFEcVZkNXpCRncwR0JGeVZuZkFCcUhLdVA0NTAzVDhXdTN5d0ItOUpQc29KdFdVeHduUHlqTFNnSHRkeG9rSGFxSm90Q1dWLWdqUXFURk5UUzVfZHJtRi0xaE1pQmlaZ3dib2NmSnJkWk44Y0phYk9PZk1RU2FNNXdGd0tDSG5t?oc=5,2026-06-22T06:51:02.755147+00:00
2026-06-18,MARKET,"High-wire diplomacy delivered US-Iran deal but hardest stage lies ahead, sources say - Reuters",Reuters,"High-wire diplomacy delivered US-Iran deal but hardest stage lies ahead, sources say  Reuters",https://news.google.com/rss/articles/CBMizAFBVV95cUxQa1dJX0x2UlpVczFzemJuZ1dvV3hQZ2cycnFNS0s5ZnlIcFl1Y0RLSHhKQXNzYVdwbHpyZDZWbVFJOTNmVG43THYxZFhCUXloMmtyelJrTFJfOFB3NVgxUUNxcno4XzRLNlhMbGtZckowdy1EdVUtV2N3Q093VFAtb1QyVUc0MGlRcHRpekZ5Yi04WHU3aTM2S2p3ZE13VlotTmU5TUZfMlZlVkxESC1BdURxdHo5ZElaVnNtYl9rNVJacFcyUnZvLXdnWDg?oc=5,2026-06-22T06:51:02.755236+00:00
2026-06-18,MARKET,"NBA to name winning bids for Europe teams in the coming months, deputy commissioner says",CNBC,"The NBA plans to name winning bidders for 12 permanent European teams in the next 60 to 90 days, Deputy Commissioner Mark Tatum told CNBC.",https://www.cnbc.com/2026/06/18/nba-europe-bids-mark-tatum.html,2026-06-22T06:51:02.755306+00:00
2026-06-18,MARKET,"US Treasury imposes sanctions on Lebanese officials, others for aiding Hezbollah - Reuters",Reuters,"US Treasury imposes sanctions on Lebanese officials, others for aiding Hezbollah  Reuters",https://news.google.com/rss/articles/CBMixAFBVV95cUxPcnd4QjhkclBlbnVhMzZNeXM4cF9ocHhzY3E4c2hlWWlsWGhuWTdPRzlZWFo3Yzh0WllCNFE3V1JERExSdHZRMElQZkl6V05HNGIyLVgtN1p6OEdNTFVydVNxMTE1Q0hFZXY3NHdYQkhRRTBUNnFmZ0hMdHdUd1RNRUF3NlVmOE9Vb1RIQ1hTU25rVUZOdFc1YmFZWTl6b3VnMlVQMURGWm1wSWY3QkFVRHkzYm9sdmFQSEZfS3NPSkVxS1lX?oc=5,2026-06-22T06:51:02.755386+00:00
2026-06-18,MARKET,"Iran's Khamenei says he approved MoU with US, despite reservations, after assurances on Iran's rights - Reuters",Reuters,"Iran's Khamenei says he approved MoU with US, despite reservations, after assurances on Iran's rights  Reuters",https://news.google.com/rss/articles/CBMiwgFBVV95cUxPczF6UzVRTUVGQXRuMmcxYm1INEtHVlRhWHEtYWhnVHlrRV90bDF0d0MxdjFmTVNQLUVzeDgxN1dMT0JjWjM2TUhJRHNBVmhXTXdpbjRvQ0hlMk5NRjhEQW9DZWpmT0xjOXRrcnlIME92VEY1b2pxaGk2NmdaZm9kOUVLX2lXYWd4U3VWcGRnQnVqNWY5TWl2Ql9XNDRzUUNZVk9KeUV5Y21JS0hHeWlpYzRKcllxeE9aSEtXVnduUUpXZw?oc=5,2026-06-22T06:51:02.755457+00:00
2026-06-18,MARKET,Markets are set for a much more hawkish Warsh Fed than expected,CNBC,Fed Chairman Kevin Warsh's tough talk on inflation Wednesday reverberated through financial markets.,https://www.cnbc.com/2026/06/18/markets-are-set-for-a-much-more-hawkish-warsh-fed-than-expected.html,2026-06-22T06:51:02.755543+00:00
2026-06-18,MARKET,"US-Iran deal redraws the Middle East: Iran gains, rivals alarmed - Reuters",Reuters,"US-Iran deal redraws the Middle East: Iran gains, rivals alarmed  Reuters",https://news.google.com/rss/articles/CBMisgFBVV95cUxNMHdqWU5BUEl6Rk5rSXlOWFpXQmtwRXdrRXlHeHlBSHFGbE1Nb1JaSUJFcnVVX1FLWlQ0b09ReTNNdFVySjNQeGdkUnpsbVg3X2lvWURuemFDOTFUQkVYRGItWkFEUE45MThwTUNQNElaYlE1akRDckRzNFZ0QWxyWkRzV3R2T2FBaTl3WXluSjQ4ZDdPZkd2eWg0OHVHblJlc1RfVnVjM1JEdkRVTzVnRWxB?oc=5,2026-06-22T06:51:02.755614+00:00
2026-06-18,MARKET,"Trump’s Iran deal extends ceasefire, opens Hormuz",Bloomberg,"US President Donald Trump agrees interim peace deal with Iran to reopen the Strait of Hormuz and launch 60-day nuclear negotiations, easing oil price pressures",https://www.bloomberg.com/news/articles/2026-06-18/trump-signs-iran-deal-shifting-focus-to-hormuz-and-60-day-talks,2026-06-22T06:51:02.755684+00:00
2026-06-18,MARKET,"Accenture forecast takes hit from Iran war, shares tumble over 17% - Reuters",Reuters,"Accenture forecast takes hit from Iran war, shares tumble over 17%  Reuters",https://news.google.com/rss/articles/CBMiygFBVV95cUxQZUtGWWhJdERFTm55bGZRRnJhVzBOa19KMi0xNlVjdFJ0OGF3VUhrSmh5Tk13OTJQQ2p6YUdyU2VQQmVCM0lUTUQ3TnpQSlA4ZHRMWkZQR3czNjVmdXVCTjJqdldHa2N6bWZ6QXBvQTA2TG9hYW9MQVFhbm1uZUFxd0tzaEUtd1pfY0puZExWMkJPaU4xSDVGYTRFRFRXTFh3OWs2MkdvckhiZkFNdUdlaFpSaTNwZDZ5TDF2MzVkYUw0aVY1RTdBNEFR?oc=5,2026-06-22T06:51:02.755755+00:00
2026-06-18,MARKET,White House sends text of interim US-Iran agreement to US Congress - Reuters,Reuters,White House sends text of interim US-Iran agreement to US Congress  Reuters,https://news.google.com/rss/articles/CBMitAFBVV95cUxNbXJPcHRCYmtQU1dlSGs4Y2dobUV1ZTRvN1dNU3c1UnlhQmVCX2hWOUU3TVQ5QlZNTHBfcjFrLTVoQUVJa19SSi14RkN3VFUxVVpsRGNlemlwaGhKc1hDT2xJNzA0LXNYTTFjX2VzZzR3ckNvaThrV1dCMDRNVnExZWtoLW1HSUkySkVZRXFuX3lBTWVDcjlFem14YUpIRU1lakFLZGhyMDNJb1czMm1iWkRmX0U?oc=5,2026-06-22T06:51:02.755835+00:00
2026-06-18,MARKET,"Western countries warn of atrocities, imminent RSF escalation in Sudan's al-Obeid - Reuters",Reuters,"Western countries warn of atrocities, imminent RSF escalation in Sudan's al-Obeid  Reuters",https://news.google.com/rss/articles/CBMizwFBVV95cUxObGNQZjM2WXd2NVlVM2xxRGNCNUtqWlM0aUFOc3Qtc25wNzREVFJlQkVTU3BMWHVfdTdZakVrMy03T3FqdlVpeVN6eUdBV2UtYndGNU9pcG5ob3hRbmhEdTR6OC1HYW1HNmQ5c0RRV0QtblllSExEeUdiY3pSMHVpTE45UFdKYm93ampwNW1uSm93WHJ5Q05MQ29ZM0hMTUIwNWxseHBhUlhPaXVuZ3ZyaWRjb09FV0M3a2xwcDZXemh3MHQ4U2wzRUtzbFNFVlU?oc=5,2026-06-22T06:51:02.755915+00:00
2026-06-18,MARKET,What sanctions are there on Iran and will they be lifted? - Reuters,Reuters,What sanctions are there on Iran and will they be lifted?  Reuters,https://news.google.com/rss/articles/CBMipgFBVV95cUxPbDd0MllvMmVzLXhIVVhYcERSVkwweHlXM3ZJZFNQLUU5VEJQUFFGeHpFcmFySGVvejBFZjVIeHdaQ0tNcjM1LVh6bmJZaVdTdk5yYnJsNDVpVmV6T2dwem5XOExEdktkVnI3U240bFpMUVVydXdGbkR6U0s0ZkJQWFcwREdpdnp5X25pYlg5UXRETFRNaHJaUkNkMWdidHJwX2RIUl9R?oc=5,2026-06-22T06:51:02.755985+00:00
2026-06-18,MARKET,Vance says 60-day period in Iran deal begins Thursday - Reuters,Reuters,Vance says 60-day period in Iran deal begins Thursday  Reuters,https://news.google.com/rss/articles/CBMilwFBVV95cUxOM1FMZEZvREcwdnplRnRTVVJpaHhwdFp6MGdWMXlpbUsyOTB2bjlPU1llQ1gyeXZDSGF1ZXpGNjduTllta1ROZVJFMEd2My10d0sydG10LWY4YU8tTWUwNmRONjlMaGtScGM1Vi1lNFVRcUlFbjdEVjBMZzROdjVTZmxZNTdUNGtQa3dzQWE3V1FjVmNxMnVV?oc=5,2026-06-22T06:51:02.756057+00:00
2026-06-18,MARKET,"Israel demarcates expanded Lebanon occupation zone, challenging US-Iran pact - Reuters",Reuters,"Israel demarcates expanded Lebanon occupation zone, challenging US-Iran pact  Reuters",https://news.google.com/rss/articles/CBMizgFBVV95cUxQbkdWQjYzX0NOaGtfVGdEdkNrNWhjYmN2V2VfWHJXTm5jWlpueEV6ekFiTHN0Nm1IaHJYMndKdTAyLTZibUtwcmlLbk5HUGhJR2w0ZFkxOHpEaWR3WThRNF80OHg4a1NUa3diajFhNEk3cU1aWV8xSHJNMjRJNjdNa2h6RnJ5RG5LTXFIQXRSVjNZR1FvemoxZzBOdWIydmZtZ3dXNlZKVVFnc0RNWW9QbE5PQWRRYXk2ZHlmRmZrWUZlU1llTjJ6S3ZJd0FYZw?oc=5,2026-06-22T06:51:02.756128+00:00
2026-06-18,MARKET,Bank of England keeps rates steady as it weighs Iran truce - Reuters,Reuters,Bank of England keeps rates steady as it weighs Iran truce  Reuters,https://news.google.com/rss/articles/CBMijwFBVV95cUxNVlBqTkljUlJidjBRbm5IeVhDa2pWakdxS3M2TElrcnVHYWJmTVhpelN0YklNOGpHVVprV2FTdjZGT2htY3RZLVZWUUhUUGQ5blVDYkpic0FlV3h6R1JseUFDRFdXNzN3UzVCdDNSMkhacWg4clg0OVJ4UkRRZTEtRmtfd3FhZXhPanN6RURDVQ?oc=5,2026-06-22T06:51:02.756197+00:00
2026-06-18,MARKET,"Three Saudi-flagged supertankers sail through Hormuz after Iran deal signed, data shows - Reuters",Reuters,"Three Saudi-flagged supertankers sail through Hormuz after Iran deal signed, data shows  Reuters",https://news.google.com/rss/articles/CBMizwFBVV95cUxPOWdZLXp2TVRxbkY3elZISTVjUE15c3EtXy1LM1pCbWlGWDVGUGxOYnlHNlpBTkExeDlpUFRsaERpNHBpNFdhTG81TDdOaVB3NlRTVjVOX3lrZmtGVHZDamFDR3hFS3FsaGw5SElCUGFqaVdKMktUd1FnZ1hzR1ZNS19fRjFHQVY2XzBEc0s2LWR6aHk2OUZGN2dSdEZJMTBtdzdiRTdNOW4zQ1FZRnFSVVVGa1pNSVJUdVkwa3RNckhCMWJGQzlMSExXMjc5WkE?oc=5,2026-06-22T06:51:02.756270+00:00
2026-06-18,MARKET,The 14-point US-Iran pact White House sent to Congress - Reuters,Reuters,The 14-point US-Iran pact White House sent to Congress  Reuters,https://news.google.com/rss/articles/CBMiiAFBVV95cUxQa1lJY0Ric2o2WU9Icy1KdkRYVFVITFlSLVJXcWhSd1JJa01pdmwzQnJCSktnMmFMT2NBb0dmcnQxUjk3LXpCSUhwdjl0VGdJdm8xcWR2dEdDS3pCeFB1TTI3V3pEUmpyOE93eDdkdkxBZG9SMUJRUW9iemFJcEhGREoyVGxKeGlY?oc=5,2026-06-22T06:51:02.756349+00:00
2026-06-18,MARKET,"Prestige Hospitality reported to have put IPO plans on hold, explores stake sale instead",Bloomberg,"Prestige Estates halts IPO plans for its hospitality unit, opting to explore a minority stake sale to private equity investors.",https://www.bloomberg.com/news/articles/2026-06-18/prestige-hospitality-is-said-to-explore-stake-sale-instead-of-ipo,2026-06-22T06:51:02.756430+00:00
2026-06-18,MARKET,Switzerland says talks planned for Friday between Iran and U.S. - Reuters,Reuters,Switzerland says talks planned for Friday between Iran and U.S.  Reuters,https://news.google.com/rss/articles/CBMiqwFBVV95cUxNaVZlUmREdTRwV2dYNHVFZm1DckNhXzBGUWwzaEpOVXRCOHdiOEV2WHdTdkR3ZE5PMTVGekItdHNmTTdSQmw4UWwydXZiZDdwaVBfNTJGR1VlanE0dUJfT3ZNejRlMXlYMWwyNEVtU3NqcnJQOG92bGxsNERITmRidm14U29iUWJGTU5qOFo2NEtBcndabW1CNV85T2RjMWZrdVliWDViS09ScW8?oc=5,2026-06-22T06:51:02.756514+00:00
2026-06-18,MARKET,ECB's Lane hints at higher rates even after Iran shock - Reuters,Reuters,ECB's Lane hints at higher rates even after Iran shock  Reuters,https://news.google.com/rss/articles/CBMimwFBVV95cUxOR2NKSzlPVXdscXlER2piOGpyS1ZFbC1NSWRyamVzdzkzVkpVeXBzYU9TMU1Od3JjOXdnaUhqTWRuTk1YcWVNM1F4U1BMQ2JkN0Q1NWJvQkFTTHk0XzlTMWNiZEVUT21WbTl1MGtaNWRfUmx6eGJ2Z1B6UUozOWFwVm9yWHJVRG9FQXhrRTVxMzZSLUx1Y01OWTdZdw?oc=5,2026-06-22T06:51:02.756591+00:00
2026-06-18,MARKET,California’s counting on an IPO tax windfall. Several factors are complicating the equation,CNBC,"The IPOs of SpaceX, OpenAI and Anthropic could create a tax windfall for the state of California. But experts say the revenue impact may be blunted.",https://www.cnbc.com/2026/06/18/california-ipo-tax-windfall.html,2026-06-22T06:51:02.756660+00:00
2026-06-18,MARKET,Jim Cramer's top 10 things to watch in the stock market Thursday,CNBC,"Apple plans price hikes, and Intel is surging on comments from President Donald Trump.",https://www.cnbc.com/2026/06/18/jim-cramers-top-10-things-to-watch-in-the-stock-market-thursday.html,2026-06-22T06:51:02.756731+00:00
2026-06-18,MARKET,Iran peace not stopping central banks from raising borrowing costs - Reuters,Reuters,Iran peace not stopping central banks from raising borrowing costs  Reuters,https://news.google.com/rss/articles/CBMitwFBVV95cUxPRzJQOGlfLXVoX0cwdFcxT3dGaTZTT1VLR25aZHY1aTBkOHNsdEJXQjF4OG5sRFJRZENDTzVtbF91bkwzdmJGNW4tWXkxaURZSDN6VGxpNnVXbmRSNG40dE4zU0lZZ2VuQ3pIRGVDRzY5Um15T3drd1BvUXBlQ0JjTHQ4RFJwU3FSckQyMzlvRE1mTUlKR284NHR2YjdBeENCdTVDZmgtSUNXMF9RYWZQdjJhdmdNR00?oc=5,2026-06-22T06:51:02.756800+00:00
2026-06-18,MARKET,"Iran war fuel spikes lift Europe's EV sales again, but growth may not last - Reuters",Reuters,"Iran war fuel spikes lift Europe's EV sales again, but growth may not last  Reuters",https://news.google.com/rss/articles/CBMivAFBVV95cUxPSWdsVWM5Y1dyRU1EOWc3UG1QTGR1d3FFVU5rMkdnbnlON01ieTdka3J1WVZzSnJ0dnVHYXE4QjNnVXVicmwzRmY3eUhUSVdfc3BVb0VNRzNRM3NjckdBSFZyZ2ViOVVDSTQ2b254YVBnbG1Ec1R1Y1U2N3NPN0hhVWw4Q1dEaWI3U05CR2dyU2NUV3YwcmpGMWN2ZTNCVVBkWUlxVl9mWWhrLTdwMnRzN0drYmJfRnpKMHN2UQ?oc=5,2026-06-22T06:51:02.756869+00:00
