Category,ResearchQuestion,Reason,Priority
Signal Quality,Are high FinalScore signals actually producing better forward returns?,"Strong signals: 28, weak signals: 28",HIGH
Sector Research,Is SPACE strength persistent or only a one-day spike?,Sector strength can be noisy if based on few tickers.,HIGH
Pattern Reliability,Which high-confidence patterns survive across different market regimes?,High confidence patterns found: 102,HIGH
Market Regime,Do signals work differently during TENSE_BULL market state?,"Same pattern may behave differently in BULL, BEAR, or TRANSITION markets.",MEDIUM
Data Quality,Which files are causing unreliable research results?,Data quality warnings/errors found: 3,HIGH
